SP500 Compound,SP500 Negative,SP500 Neutral,SP500 Positive,SP500 Text,Cramer Compound,Cramer Negative,Cramer Neutral,Cramer Positive,Cramer Text,Trump Compound,Trump Negative,Trump Neutral,Trump Positive,Trump Text,Dimon Compound,Dimon Negative,Dimon Neutral,Dimon Positive,Dimon Text,Blankfein Compound,Blankfein Negative,Blankfein Neutral,Blankfein Positive,Blankfein Text,Solomon Compound,Solomon Negative,Solomon Neutral,Solomon Positive,Solomon Text,Corbat Compound,Corbat Negative,Corbat Neutral,Corbat Positive,Corbat Text,Lead economists Compound,Lead economists Negative,Lead economists Neutral,Lead economists Positive,Lead economists Text,Powell Compound,Powell Negative,Powell Neutral,Powell Positive,Powell Text,FED Compound,FED Negative,FED Neutral,FED Positive,FED Text,Fink Compound,Fink Negative,Fink Neutral,Fink Positive,Fink Text
,,,,,,,,,,,,,,,,,,,,,,,,,,,,,,,,,,,0.2732,0.041,0.897,0.062,"introduction
just as the bears were starting to enjoy their day in the sun, the bulls came roaring back, as the s&amp;p 500 has surged 25% from its low three weeks ago. the rally started out as a bounce from a deeply oversold technical condition for the mark… [+16925 chars]",,,,,,,,,,,,,,,
,,,,,,,,,,,,,,,,,,,,,,,,,,,,,,,,,,,0.8126,0.0,0.833,0.167,"new york: wall street closed out its best week in 45 years on thursday after the federal reserve launched its latest titanic effort to support the economy through the coronavirus outbreak.
the central bank announced programs to provide up to $2.3 trillion in… [+5597 chars]",,,,,,,,,,,,,,,
,,,,,,,,,,,,,,,,,,,,,,,,,,,,,,,,,,,0.631,0.0,0.893,0.107,"nourish your hopes, but do not overlook realities.
..... sir winston churchill
economists, analysts, and market pundits are all busy now trying to figure out what any potential economic recovery is going to look like. in the coming days/weeks we will hear a… [+27443 chars]",,,,,,,,,,,,,,,
,,,,,,,,,,,,,,,,,,,,,,,,,,,,,,,,,,,0.631,0.0,0.893,0.107,"nourish your hopes, but do not overlook realities.
..... sir winston churchill
economists, analysts, and market pundits are all busy now trying to figure out what any potential economic recovery is going to look like. in the coming days/weeks we will hear a… [+27443 chars]",,,,,,,,,,,,,,,
,,,,,,,,,,,,,,,,,,,,,,,,,,,,,,,,,,,0.1027,0.071,0.849,0.079,"has another great depression begun? 
the stock market does not appear to think so. as of yesterday, the stock market was only down from its peak by 17.6%, below the 20% cutoff characterizing a bear market.
indeed, the reaction of the stock market to events … [+10302 chars]",,,,,,,,,,,,,,,
,,,,,,,,,,,,,,,,,,,,,,,,,,,,,,,,,,,0.7906,0.077,0.714,0.209,"if theres a downside to an over decade-long bull-run, its that some investors get too comfortable with risk. they see the daily growth of the market, pumping a greater percentage of their portfolio into stocks, expecting the party to never run out.
of course… [+6272 chars]",,,,,,,,,,,,,,,
,,,,,,,,,,,,,,,,,,,,,,,,,,,,,,,,,,,0.8126,0.0,0.833,0.167,"new york (ap) wall street closed out its best week in 45 years on thursday after the federal reserve launched its latest titanic effort to support the economy through the coronavirus outbreak.
the central bank announced programs to provide up to $2.3 trillio… [+5652 chars]",,,,,,,,,,,,,,,
,,,,,,,,,,,,,,,,,,,,,,,,,,,,,,,,,,,0.8126,0.0,0.83,0.17,new york (ap) wall street closed out its best week in 45 years on thursday after the federal reserve launched its latest titanic effort to support the economy through the coronavirus outbreak.the central bank announced programs to provide up to $2.3 trillion … [+5801 chars],,,,,,,,,,,,,,,
,,,,,,,,,,,,,,,,,,,,,,,,,,,,,,,,,,,0.8126,0.0,0.833,0.167,"wall street closed out its best week in 45 years on thursday after the federal reserve launched its latest titanic effort to support the economy through the coronavirus outbreak.
the central bank announced programs to provide up to $2.3 trillion in loans to … [+5897 chars]",,,,,,,,,,,,,,,
,,,,,,,,,,,,,,,,,,,,,,,,,,,,,,,,,,,0.8957,0.0,0.768,0.232,"new york -- 
the s&amp;p 500 index closed out its best week since 1974 with another gain thursday after the federal reserve launched its latest unprecedented effort to support the economy through the coronavirus outbreak. the central banks announcement of pr… [+6671 chars]",,,,,,,,,,,,,,,
,,,,,,,,,,,,,,,,,,,,,,,,,,,,,,,,,,,0.8689,0.0,0.792,0.208,"new york (ap) — stocks are rising on wall street thursday after the federal reserve launched its latest unprecedented effort to support the economy through the coronavirus outbreak. the gains put the s&amp;p 500 on track for its best week since 1974.
the cen… [+5643 chars]",,,,,,,,,,,,,,,
,,,,,,,,,,,,,,,,,,,,,,,,,,,,,,,,,,,0.4939,0.0,0.905,0.095,"new york — stocks rose in midday trading on wall street thursday after the federal reserve launched its latest unprecedented effort to support the economy through the coronavirus outbreak.
the central bank undertook actions to provide up to $2.3 trillion in … [+4211 chars]",,,,,,,,,,,,,,,
,,,,,,,,,,,,,,,,,,,,,,,,,,,,,,,,,,,-0.2023,0.116,0.784,0.1,"the indian market remained on the volatile track and gave up all gains of the morning session, following a negative opening in the european markets.
sensex ended 173 points, or 0.58 percent, lower at 29,893.96 while nifty settled 43 points, or 0.49 percent, … [+8375 chars]",,,,,,,,,,,,,,,
,,,,,,,,,,,,,,,,,,,,,,,,,,,,,,,,,,,0.3612,0.076,0.782,0.142,"while the latest news of a potential slowdown in new u.s. covid-19 cases brings an optimistic tone to wall street, the impacts of the global economic crisis have not been fully priced into the market. we certainly hope there is a continued slowdown in new cas… [+4968 chars]",,,,,,,,,,,,,,,
,,,,,,,,,,,,,,,,,,,,,,,,,,,,,,,,,,,-0.7184,0.172,0.779,0.049,"the coronavirus (covid-19) is impacting the global economy and raising fears of a recession. what causes a recession and what are the signs?
usa today
stocks added to early gains wednesday after sen. bernie sanders dropped out of the u.s. presidential race.… [+5108 chars]",,,,,,,,,,,,,,,
,,,,,,,,,,,,,,,,,,,,,,,,,,,,,,,,,,,0.4779,0.089,0.781,0.13,"wuhan has reopened, somewhat. while travel to and from the city is now allowed, some restrictions inside the city remain, there is no timetable for schools to reopen, and officials are clearly very worried about a a resurgence of infections. it is great to se… [+81632 chars]",,,,,,,,,,,,,,,
,,,,,,,,,,,,,,,,,,,,,,,,,,,,,,,,,,,0.34,0.0,0.945,0.055,"(for a live blog on the u.s. stock market, click live/ or type live/ in a news window)
* futures near one-month high
* exxon, halliburton track oil prices higher
* cruise operators lead gains among s&amp;p 500 firms
* futures up: dow 3.24%, s&amp;p 2.8%, … [+2770 chars]",,,,,,,,,,,,,,,
,,,,,,,,,,,,,,,,,,,,,,,,,,,,,,,,,,,0.6815,0.038,0.81,0.152,global markets rallied for the second day as signs of progress against the coronavirus in both europe and the united states and more aggressive helpings of stimulus kept investors charging back in.  us index futures bounced for a second straight day on tuesda… [+28031 chars],,,,,,,,,,,,,,,
,,,,,,,,,,,,,,,,,,,,,,,,,,,,,,,,,,,0.4019,0.0,0.941,0.059,"by geoffrey smith 
investing.com -- gold prices hit their highest in nearly eight years as investors pile into the safest of havens even after one of the biggest-ever one-day rallies in u.s. stocks. global stock markets have followed the u.s. higher overnigh… [+5305 chars]",,,,,,,,,,,,,,,
,,,,,,,,,,,,,,,,,,,,,,,,,,,,,,,,,,,0.8442,0.0,0.822,0.178,"indian market is staring at a higher opening on tuesday following its global peers as they returned with a sharp rebound on hopes of pandemic stabilising. at 7:10 am, the sgx nifty traded 10 points higher at 8,471, hinting at a positive opening for the sensex… [+4551 chars]",,,,,,,,,,,,,,,
,,,,,,,,,,,,,,,,,,,,,,,,,,,,,,,,,,,-0.8781,0.271,0.67,0.059,"president donald trump is confronting the most dangerous crisis a united states leader has faced this century as the coronavirus spreads and a once-vibrant economy falters.
 as the turmoil deepens, the choices he makes in the critical weeks ahead will shape … [+10065 chars]",,,,,,,,,,,,,,,
,,,,,,,,,,,,,,,,,,,,,,,,,,,,,,,,,,,0.7809,0.0,0.846,0.154,"there was some good financial news monday afternoon for everyone who isn't yet dead from covid. the dow was up 1,200 points with defense contractor raytheon technologies and american express taking the lead. the s&amp;p 500 and the nasdaq shot up at 5.6 perce… [+4392 chars]",,,,,,,,,,,,,,,
,,,,,,,,,,,,,,,,,,,,,,,,,,,,,,,,,,,0.891,0.0,0.756,0.244,"stars and stripes is making stories on the coronavirus pandemic available free of charge. see other free reports here. sign up for our daily coronavirus newsletter here. please support our journalism with a subscription.
washington president donald trump is … [+8699 chars]",,,,,,,,,,,,,,,
,,,,,,,,,,,,,,,,,,,,,,,,,,,,,,,,,,,-0.6705,0.155,0.794,0.051,"canada may face an historic downturn, struck by the global pandemic and fuelled by issues that were already haunting the economyin every economic crisis over the last century, people have ultimately turned to the world of medicine to help make sense of the fe… [+20460 chars]",,,,,,,,,,,,,,,
,,,,,,,,,,,,,,,,,,,,,,,,,,,,,,,,,,,-0.9212,0.277,0.723,0.0,"washington -- 
president donald trump is confronting the most dangerous crisis a u.s. leader has faced this century as the coronavirus spreads and a once-vibrant economy falters. as the turmoil deepens, the choices he makes in the critical weeks ahead will s… [+8498 chars]",,,,,,,,,,,,,,,
,,,,,,,,,,,,,,,,,,,,,,,,,,,,,,,,,,,-0.9212,0.277,0.723,0.0,"ap 
washington president donald trump is confronting the most dangerous crisis a u.s. leader has faced this century as the coronavirus spreads and a once-vibrant economy falters. as the turmoil deepens, the choices he makes in the critical weeks ahead will s… [+8734 chars]",,,,,,,,,,,,,,,
,,,,,,,,,,,,,,,,,,,,,,,,,,,,,,,,,,,-0.9212,0.277,0.723,0.0,"president donald trump is confronting the most dangerous crisis a u.s. leader has faced this century as the coronavirus spreads and a once-vibrant economy falters. as the turmoil deepens, the choices he makes in the critical weeks ahead will shape his reelect… [+8619 chars]",,,,,,,,,,,,,,,
,,,,,,,,,,,,,,,,,,,,,,,,,,,,,,,,,,,-0.9212,0.282,0.718,0.0,"washington - president donald trump is confronting the most dangerous crisis a u.s. leader has faced this century as the coronavirus spreads and a once-vibrant economy falters. as the turmoil deepens, the choices he makes in the critical weeks ahead will shap… [+8272 chars]",,,,,,,,,,,,,,,
,,,,,,,,,,,,,,,,,,,,,,,,,,,,,,,,,,,0.6707,0.055,0.789,0.156,"editors' note: this is the transcript of the podcast we posted last week. please note that due to time and audio constraints, transcription may not be perfect. we encourage you to listen to the podcast, embedded below, if you need any clarification. we hope y… [+79319 chars]",,,,,,,,,,,,,,,
,,,,,,,,,,,,,,,,,,,,,,,,,,,,,,,,,,,-0.9212,0.277,0.723,0.0,"washington (ap) president donald trump is confronting the most dangerous crisis a us leader has faced this century as the coronavirus spreads and a once-vibrant economy falters. as the turmoil deepens, the choices he makes in the critical weeks ahead will sha… [+8403 chars]",,,,,,,,,,,,,,,
,,,,,,,,,,,,,,,,,,,,,,,,,,,,,,,,,,,-0.9212,0.282,0.718,0.0,"washington president donald trump is confronting the most dangerous crisis a u.s. leader has faced this century as the coronavirus spreads and a once-vibrant economy falters. as the turmoil deepens, the choices he makes in the critical weeks ahead will shape … [+8348 chars]",,,,,,,,,,,,,,,
,,,,,,,,,,,,,,,,,,,,,,,,,,,,,,,,,,,-0.9212,0.282,0.718,0.0,"washington - president donald trump is confronting the most dangerous crisis a u.s. leader has faced this century as the coronavirus spreads and a once-vibrant economy falters. as the turmoil deepens, the choices he makes in the critical weeks ahead will shap… [+8737 chars]",,,,,,,,,,,,,,,
,,,,,,,,,,,,,,,,,,,,,,,,,,,,,,,,,,,-0.9212,0.277,0.723,0.0,"washington (ap) president donald trump is confronting the most dangerous crisis a u.s. leader has faced this century as the coronavirus spreads and a once-vibrant economy falters. as the turmoil deepens, the choices he makes in the critical weeks ahead will s… [+8620 chars]",,,,,,,,,,,,,,,
,,,,,,,,,,,,,,,,,,,,,,,,,,,,,,,,,,,-0.9212,0.277,0.723,0.0,"washington (ap) president donald trump is confronting the most dangerous crisis a u.s. leader has faced this century as the coronavirus spreads and a once-vibrant economy falters. as the turmoil deepens, the choices he makes in the critical weeks ahead will s… [+8472 chars]",,,,,,,,,,,,,,,
,,,,,,,,,,,,,,,,,,,,,,,,,,,,,,,,,,,-0.34,0.05,0.95,0.0,"last week we reported that morgan stanley's micheal wilson, who for most of 2018 and 2019 emerged as the biggest bear among wall street's big banks (this of course excludes such outlier bears as socgen's albert edwards who has for years been warning about wha… [+5987 chars]",,,,,,,,,,,,,,,
,,,,,,,,,,,,,,,,,,,,,,,,,,,,,,,,,,,0.3597,0.069,0.811,0.12,"good morning and welcome to the second quarter, where ammunition sales are spiking and the only meat in left in the supermarket is likely plant-based. currently, market futures are pointing to a slightly negative open, confirming the recent rally was a head f… [+8544 chars]",,,,,,,,,,,,,,,
,,,,,,,,,,,,,,,,,,,,,,,,,,,,,,,,,,,0.7003,0.072,0.742,0.186,"real estate weekly outlook
will the rent get paid? following strong gains last week after the successful passage of the massive $2.2 trillion stimulus package, u.s. equity markets declined on another volatile week as employment data painted a grim picture of… [+18989 chars]",,,,,,,,,,,,,,,
,,,,,,,,,,,,,,,,,,,,,,,,,,,,,,,,,,,-0.5719,0.114,0.845,0.041,"toronto -- 
canada's main stock index moved higher thursday as energy stocks surged on a record 25 per cent rise in crude oil prices.
oil prices jumped after u.s. president donald trump tweeted that he expected saudi arabia and russia to cut production by 1… [+2653 chars]",,,,,,,,,,,,,,,
,,,,,,,,,,,,,,,,,,,,,,,,,,,,,,,,,,,-0.7003,0.192,0.751,0.056,"<ul><li>the dow jones swung wildly between gains and losses on thursday.</li><li>stock market bulls shrugged off a miserable jobless claims report as trump rallied the oil price.</li><li>as the coronavirus shutdown continues, financial pressures on balance sh… [+4713 chars]",,,,,,,,,,,,,,,
,,,,,,,,,,,,,,,,,,,,,,,,,,,,,,,,,,,0.4215,0.0,0.905,0.095,"as the international spread of the novel coronavirus continues battering economies and taking down financial markets, many investors have selectively started buying stocks, exclusive survey data show.
of the 159 institutional investors surveyed on their next… [+3767 chars]",,,,,,,,,,,,,,,
,,,,,,,,,,,,,,,,,,,,,,,,,,,,,,,,,,,0.6808,0.036,0.826,0.138,"* wall street closes down more than 4% 
* investors look nervously ahead to earnings 
* oil slides as consumption slows, inventories build 
* dollar, yen gain on safety bid 
by tom westbrook and herbert lash 
sydney/new york, april 2 (reuters) - asian eq… [+4029 chars]",,,,,,,,,,,,,,,
,,,,,,,,,,,,,,,,,,,,,,,,,,,,,,,,,,,-0.9524,0.341,0.659,0.0,"sydney/new york: asian equity markets and crude oil looked set for further losses on thursday, after a dire warning about the us coronavirus death toll and mounting evidence the fast-spreading disease has sent the world economy hurtling into a deep recession.… [+3925 chars]",,,,,,,,,,,,,,,
,,,,,,,,,,,,,,,,,,,,,,,,,,,,,,,,,,,-0.9633,0.374,0.626,0.0,"asian equity markets and crude oil looked set for further losses on thursday, after a dire warning about the u.s. coronavirus death toll and mounting evidence the fast-spreading disease has sent the world economy hurtling into a deep recession.
stocks on wal… [+3720 chars]",,,,,,,,,,,,,,,
,,,,,,,,,,,,,,,,,,,,,,,,,,,,,,,,,,,,,,,,0.6652,0.039,0.823,0.138,"wolf richter wolfstreet.com, www.amazon.com/author/wolfrichter
holy moly, what a mess. but here is our hilarious cartoon of jerome powell tearing out his hair. gotta keep you sense of humor.
sunday at 5 p.m., the frazzled fed announced in a statement that i… [+4452 chars]",,,,,,,,,,
,,,,,,,,,,,,,,,,,,,,,,,,,,,,,,,,,,,,,,,,,,,,,0.5106,0.083,0.769,0.148,"<ul><li>gold prices jump to fresh seven-year highs and hold the fort in the 1720s in asia. </li><li>usd/jpy moving to fresh lows, supporting gold higher as us dollar slides. </li></ul>the us dollar was soft on monday and with the uncertainty pertaining to cov… [+1462 chars]",,,,,
,,,,,,,,,,,,,,,,,,,,,,,,,,,,,,,,,,,,,,,,,,,,,0.2081,0.056,0.851,0.093,"stock prices have rebounded on the news that the covid-19 pandemic is improving in new york and other parts of the u.s., and on the news that the fed unveiled another $2.3 trillion bazooka of liquidity. despite these positives, several important factors, incl… [+11391 chars]",,,,,
,,,,,,,,,,,,,,,,,,,,,,,,,,,,,,,,,,,,,,,,,,,,,-0.4215,0.103,0.85,0.047,"stocks fell on wall street monday, erasing some of the market’s big gains from last week, as investors braced for a sobering first look at how the coronavirus pandemic has hurt company earnings.
a man with a protective mask stands in the rain in front of an … [+6025 chars]",,,,,
,,,,,,,,,,,,,,,,,,,,,,,,,,,,,,,,,,,,,,,,,,,,,-0.7184,0.178,0.777,0.045,"stocks fell on wall street monday, erasing some of the market’s big gains from last week, as investors braced for a sobering first look at how the coronavirus pandemic has hurt company earnings.
the s&amp;p 500 fell 1% after cutting its early losses by more … [+5231 chars]",,,,,
,,,,,,,,,,,,,,,,,,,,,,,,,,,,,,,,,,,,,,,,,,,,,0.802,0.053,0.733,0.213,"<ul><li>us stocks slid on monday in their first day of trading after the s&amp;p 500 completed its best weekly gain since 1974.</li><li>investors mulled heightened uncertainty heading into earnings season.</li><li>jpmorgan, wells fargo, and johnson &amp; john… [+5158 chars]",,,,,
,,,,,,,,,,,,,,,,,,,,,,,,,,,,,,,,,,,,,,,,,,,,,-0.6124,0.134,0.813,0.053,"late last week, we showed a chart from credit suisse which could be simply described as ""insanity"" because it demonstrated that as the us careened into a depression, with gdp crashing and the unemployment rate soaring, between the latest fed-driven surge in s… [+10619 chars]",,,,,
,,,,,,,,,,,,,,,,,,,,,,,,,,,,,,,,,,,,,,,,,,,,,0.2732,0.067,0.8,0.133,"analysts from wall streets top firms are getting more bullish on u.s. equities.
swift and sweeping fiscal and monetary policy responses from u.s. officials will ultimately support stock prices from here, blunting some of the damage as the coronavirus pandemi… [+6501 chars]",,,,,
,,,,,,,,,,,,,,,,,,,,,,,,,,,,,,,,,,,,,,,,,,,,,-0.4767,0.113,0.839,0.048,"stocks are closing lower on wall street as investors brace for what is sure to be widespread damage to company earnings because of the coronavirus. major banks and other companies will start reporting their earnings this week, including jpmorgan chase, which … [+5489 chars]",,,,,
,,,,,,,,,,,,,,,,,,,,,,,,,,,,,,,,,,,,,,,,,,,,,0.802,0.052,0.739,0.209,"<ul><li>us stocks slid on monday in their first day of trading after the s&amp;p 500 completed its best weekly gain since 1974.</li><li>investors mulled heightened uncertainty heading into earnings season. </li><li>jpmorgan, wells fargo, and johnson &amp; joh… [+3222 chars]",,,,,
,,,,,,,,,,,,,,,,,,,,,,,,,,,,,,,,,,,,,,,,,,,,,0.25,0.068,0.844,0.089,"after the best week in decades for stocks...
consumer sentiment just suffered the largest single-month decline on record as americans became increasingly rattled by thousands of business closings and millions of layoffs across the country. not only did the u… [+3222 chars]",,,,,
,,,,,,,,,,,,,,,,,,,,,,,,,,,,,,,,,,,,,,,,,,,,,0.1531,0.046,0.896,0.058,"photo by brooks kraft/ getty images
2016 brooks kraft
the easiest people to pick on in the market the last five years have been those decrying the everything bubble the permabears, twitter ranters, spam-hoarders and bitcoin hodlers who spent the bulk of the… [+3896 chars]",,,,,
,,,,,,,,,,,,,,,,,,,,,,,,,,,,,,,,,,,,,,,,,,,,,-0.4404,0.065,0.935,0.0,"<ul><li>the dow jones fell on monday, in part because coronavirus economic impact is expected to linger.</li><li>trumps plans to reopen the economy are a worry for the stock market as china reports an uptick in new cases.</li><li>four of the dows 30 member st… [+4288 chars]",,,,,
,,,,,,,,,,,,,,,,,,,,,,,,,,,,,,,,,,,,,,,,,,,,,0.296,0.095,0.806,0.099,"canaccord genuity chief market strategist tony dwyer is no stranger to bullish stock-market calls, but after a remarkable run for u.s. stocks over the past few weeks, he is now warning investors of a pullback ahead. bear markets typically have three phrases y… [+2512 chars]",,,,,
,,,,,,,,,,,,,,,,,,,,,,,,,,,,,,,,,,,,,,,,,,,,,-0.2023,0.04,0.96,0.0,"efforts by the federal reserve and other central banks to keep global financial markets functioning as the world reeled from the shock of the covid-10 pandemic are bearing fruit, but policy makers shouldnt spend too much time patting themselves on the back.pa… [+4392 chars]",,,,,
,,,,,,,,,,,,,,,,,,,,,,,,,,,,,,,,,,,,,,,,,,,,,0.3182,0.0,0.943,0.057,"prominent morgan stanley analyst michael wilson is getting more bullish about stocks.morgan stanleys chief u.s. equity strategist in a monday research note, along with a team that includes adam virgadamo, andrew pauker and michelle weaver, doubled down on the… [+3426 chars]",,,,,
,,,,,,,,,,,,,,,,,,,,,,,,,,,,,,,,,,,,,,,,,,,,,0.0,0.0,1.0,0.0,"citation: duarte-restrepo e, jaramillo-colorado be, duarte-jaramillo l (2020) effects of chlorpyrifos on the crustacean litopenaeus vannamei. plos one 15(4):
 e0231310.
https://doi.org/10.1371/journal.pone.0231310
editor: iddya karunasagar, nitte universit… [+24331 chars]",,,,,
,,,,,,,,,,,,,,,,,,,,,,,,,,,,,,,,,,,,,,,,,,,,,-0.4019,0.091,0.862,0.047,"abstract
leishmania donovani causes visceral leishmaniasis (vl), which is typically fatal without treatment. there is substantial variation between individuals in rates of disease progression, response to treatment and incidence of post-treatment sequelae, s… [+70873 chars]",,,,,
,,,,,,,,,,,,,,,,,,,,,,,,,,,,,,,,,,,,,,,,,,,,,0.1027,0.081,0.806,0.114,"abstract
dipeptidyl peptidase-4 (dpp-4) is a proteolytic enzyme responsible for the rapid degradation of glucagon-like peptide 1 (glp-1) that is required for the secretion of insulin. dpp-4 also influences activation of node like receptor family, pyrin domai… [+45865 chars]",,,,,
,,,,,,,,,,,,,,,,,,,,,,,,,,,,,,,,,,,,,,,,,,,,,0.6597,0.037,0.837,0.127,"amidst the economic carnage that has been inflicted on the global economy, there surprisingly has been a tremendous rally taking place. indeed the s&amp;p is up 24% from its lows march 23rd.
this has gone against the smartest investing minds i know and follo… [+16934 chars]",,,,,
,,,,,,,,,,,,,,,,,,,,,,,,,,,,,,,,,,,,,,,,,,,,,0.0,0.0,1.0,0.0,"source: cnbc.com
the s&amp;p 500/spx (sp500) has surged by over 25% since a bottom was put in several weeks ago.
source:stockcharts.com
it has been a notable rebound since we called the bottom in our marketplace group on march 23rd.
source
however, a pot… [+11159 chars]",,,,,
,,,,,,,,,,,,,,,,,,,,,,,,,,,,,,,,,,,,,,,,,,,,,0.4215,0.052,0.858,0.09,"for much of 2019, morgan stanley's chief equity strategist micheal wilson issued a weekly sermon of fire and brimstone in his monday morning market takes, which contrasted with the euphoric pronouncements by his peers at other banks - most notably goldman, wh… [+9667 chars]",,,,,
,,,,,,,,,,,,,,,,,,,,,,,,,,,,,,,,,,,,,,,,,,,,,0.0,0.0,1.0,0.0,"in an intra-day note to investors, gorilla trades strategist ken berman, while commenting on the price oil and energy-related stocks, said:
get our activist investing case study!
get the entire 10-part series on our in-depth study on activist investing in p… [+2220 chars]",,,,,
,,,,,,,,,,,,,,,,,,,,,,,,,,,,,,,,,,,,,,,,,,,,,0.4576,0.0,0.935,0.065,"it's time to discuss one of the most interesting reits on the market. the san francisco, ca-based provider of logistics real estate prologis (nyse:pld) is operating in one of the hottest markets right now. the company is benefiting from a domestic and global … [+12801 chars]",,,,,
,,,,,,,,,,,,,,,,,,,,,,,,,,,,,,,,,,,,,,,,,,,,,0.765,0.041,0.787,0.171,"the s&amp;p 500 enjoyed its biggest bounce in 46 years last week. which followed the biggest/fastest drop from an all-time high since, well, ever. so, naturally, the question now becomes, where do we go from here?
markets cheered the fed's sledgehammer respo… [+12007 chars]",,,,,
,,,,,,,,,,,,,,,,,,,,,,,,,,,,,,,,,,,,,,,,,,,,,0.0,0.0,1.0,0.0,"ray dalio (trades, portfolio), the billionaire hedge fund manager, famously claimed ""cash is trash"" in january. at the time, covid-19 was not classified as a pandemic by the world health organization, and many expected the spread of the virus to be contained … [+7908 chars]",,,,,
,,,,,,,,,,,,,,,,,,,,,,,,,,,,,,,,,,,,,,,,,,,,,0.4939,0.0,0.938,0.062,"eschler recovery fund commentary for the first quarter ended march 31, 2020.
get the full series in pdf
get the entire 10-part series on charlie munger in pdf. save it to your desktop, read it on your tablet, or email to your colleagues.
q1 2020 hedge fund… [+11427 chars]",,,,,
,,,,,,,,,,,,,,,,,,,,,,,,,,,,,,,,,,,,,,,,,,,,,0.0,0.0,1.0,0.0,"my oh my how a two-week long bear market rally and unprecedented stimulus actions by the federal reserve could change ones thinking on stocks still dealing with the bruising coronavirus pandemic.
somewhat under the radar on monday, veteran goldman sachs stra… [+2334 chars]",,,,,
